{
  "schemaVersion": "1.0",
  "corpusVersion": "1.0.0",
  "provenance": {
    "source": "local PostgreSQL populated by the GDELT pipeline",
    "selectionStart": "2026-07-12T20:15:00+00:00",
    "selectionEndExclusive": "2026-07-20T18:45:00+00:00",
    "generatedAt": "2026-07-20T20:19:25.254768+00:00",
    "fullTextStored": false
  },
  "articles": [
    {
      "ref": "article-011ce56bff40194f",
      "urlHash": "011ce56bff40194f0e8a93c1cc99d8a4d882a60be9331483d65445d46a6bc11f",
      "canonicalUrl": "https://www.wandsworthguardian.co.uk/news/national/26275278.murder-ann-widdecombe-investigated-potential-act-terrorism",
      "domain": "www.wandsworthguardian.co.uk",
      "title": "Murder of Ann Widdecombe being investigated as potential act of terrorism",
      "titleInputHash": "395cce1a2e2c80c73f4a9c87ef21aae6932117d92cef2e0507538012e4ab203d",
      "firstSeenAt": "2026-07-13T17:15:00Z",
      "publishedAt": "2026-07-13T17:28:00Z"
    },
    {
      "ref": "article-0159b3adcd258aeb",
      "urlHash": "0159b3adcd258aeb77560afbfa45a49d280b479bcd77f8bdb6fe181355492ac7",
      "canonicalUrl": "https://www.asianimage.co.uk/news/national/26288568.helicopter-deployed-firefighters-spend-third-day-tackling-cairngorms-wildfire",
      "domain": "www.asianimage.co.uk",
      "title": "Helicopter deployed as firefighters spend third day tackling Cairngorms wildfire",
      "titleInputHash": "5c88400cc2532c9b1b3bfab4a27c52f7d4624ce10ee9778b8edd56953ea17c51",
      "firstSeenAt": "2026-07-17T11:00:00Z",
      "publishedAt": "2026-07-17T10:48:00Z"
    },
    {
      "ref": "article-02004a1ad8c4ce80",
      "urlHash": "02004a1ad8c4ce8022848c895870d4ee34b6030e825517f34d27733f698d501f",
      "canonicalUrl": "https://www.westerntelegraph.co.uk/news/national/26275278.murder-ann-widdecombe-investigated-potential-act-terrorism",
      "domain": "www.westerntelegraph.co.uk",
      "title": "Murder of Ann Widdecombe being investigated as potential act of terrorism",
      "titleInputHash": "395cce1a2e2c80c73f4a9c87ef21aae6932117d92cef2e0507538012e4ab203d",
      "firstSeenAt": "2026-07-13T18:45:00Z",
      "publishedAt": "2026-07-13T17:28:00Z"
    },
    {
      "ref": "article-0280bbb31930fe98",
      "urlHash": "0280bbb31930fe9894cd01d5d0a3d033ba9608e640ae116099ca07baa4f121aa",
      "canonicalUrl": "https://www.marinij.com/2026/07/11/sen-lindsey-graham-a-close-trump-ally-and-foreign-policy-hawk-dies-after-a-brief-illness",
      "domain": "www.marinij.com",
      "title": "Sen. Lindsey Graham, a close Trump ally and foreign policy hawk, dies after a brief illness",
      "titleInputHash": "56f59a561b6228d53f5168b531de6797c9427e1392942cd8b4c335f19c388a37",
      "firstSeenAt": "2026-07-12T20:15:00Z",
      "publishedAt": "2026-07-12T06:38:00Z"
    },
    {
      "ref": "article-02aa693190fa74d2",
      "urlHash": "02aa693190fa74d2cf0216b69187ad10adc3433bcb1178034774d8eefdcec1e1",
      "canonicalUrl": "https://newstalk1230.iheart.com/content/2026-07-13-tourist-hospitalized-after-bison-tossed-him-into-the-air-at-yellowstone",
      "domain": "newstalk1230.iheart.com",
      "title": "Tourist Hospitalized After Bison Tossed Him Into The Air At Yellowstone",
      "titleInputHash": "298b3deda654c367b670524b9144ace8dedd2a256133a8d34c623ab6f3bc9ed2",
      "firstSeenAt": "2026-07-13T18:45:00Z"
    },
    {
      "ref": "article-0323906776dcce3d",
      "urlHash": "0323906776dcce3d18cba27fe3aa77a4d435fc5b48b511e692adf9442efd40d0",
      "canonicalUrl": "https://www.freepressseries.co.uk/news/national/26280310.trump-backs-threat-levy-tolls-shipping-strait-hormuz",
      "domain": "www.freepressseries.co.uk",
      "title": "Trump backs down over threat to levy tolls on shipping in Strait of Hormuz",
      "titleInputHash": "e006abacd7c0dc37dad6518aaee4e963849d3aa8d6a83d84b14eb74b09cd5ae4",
      "firstSeenAt": "2026-07-14T17:30:00Z",
      "publishedAt": "2026-07-14T17:36:00Z"
    },
    {
      "ref": "article-0339a998206d04cf",
      "urlHash": "0339a998206d04cfb62e5a5a2c0c11102d2096deea8f6339b2b82769d2acd81a",
      "canonicalUrl": "https://1037theq.iheart.com/content/2026-07-13-tourist-hospitalized-after-bison-tossed-him-into-the-air-at-yellowstone",
      "domain": "1037theq.iheart.com",
      "title": "Tourist Hospitalized After Bison Tossed Him Into The Air At Yellowstone",
      "titleInputHash": "298b3deda654c367b670524b9144ace8dedd2a256133a8d34c623ab6f3bc9ed2",
      "firstSeenAt": "2026-07-13T18:15:00Z"
    },
    {
      "ref": "article-04eb549f73fa4f08",
      "urlHash": "04eb549f73fa4f08159d7a381d5a6c8d38cea9c6498c3bf70c8e21b7ccfcc7b3",
      "canonicalUrl": "https://realradio.iheart.com/content/2026-07-13-tourist-hospitalized-after-bison-tossed-him-into-the-air-at-yellowstone",
      "domain": "realradio.iheart.com",
      "title": "Tourist Hospitalized After Bison Tossed Him Into The Air At Yellowstone",
      "titleInputHash": "298b3deda654c367b670524b9144ace8dedd2a256133a8d34c623ab6f3bc9ed2",
      "firstSeenAt": "2026-07-13T18:15:00Z"
    },
    {
      "ref": "article-05b7eeb8b11c7112",
      "urlHash": "05b7eeb8b11c71128f3961046f7cd9930173865af5684d6406178b32a67c74b7",
      "canonicalUrl": "https://www.chardandilminsternews.co.uk/news/national/26288568.helicopter-deployed-firefighters-spend-third-day-tackling-cairngorms-wildfire",
      "domain": "www.chardandilminsternews.co.uk",
      "title": "Helicopter deployed as firefighters spend third day tackling Cairngorms wildfire",
      "titleInputHash": "5c88400cc2532c9b1b3bfab4a27c52f7d4624ce10ee9778b8edd56953ea17c51",
      "firstSeenAt": "2026-07-17T10:15:00Z"
    },
    {
      "ref": "article-05c4a69393d4a25e",
      "urlHash": "05c4a69393d4a25e8fb2fc9613bd9f5b54250bdabcf0f319bdd6f425a4730946",
      "canonicalUrl": "https://www.hillingdontimes.co.uk/news/national/26280310.trump-backs-threat-levy-tolls-shipping-strait-hormuz",
      "domain": "www.hillingdontimes.co.uk",
      "title": "Trump backs down over threat to levy tolls on shipping in Strait of Hormuz",
      "titleInputHash": "e006abacd7c0dc37dad6518aaee4e963849d3aa8d6a83d84b14eb74b09cd5ae4",
      "firstSeenAt": "2026-07-14T17:45:00Z",
      "publishedAt": "2026-07-14T17:36:00Z"
    },
    {
      "ref": "article-0689c15f975a8b9e",
      "urlHash": "0689c15f975a8b9e8a8f7487f9fbef8c7c92978f1804a8abac9b2cb622f1a0a4",
      "canonicalUrl": "https://www.london-now.co.uk/news/national/26280310.trump-backs-threat-levy-tolls-shipping-strait-hormuz",
      "domain": "www.london-now.co.uk",
      "title": "Trump backs down over threat to levy tolls on shipping in Strait of Hormuz",
      "titleInputHash": "e006abacd7c0dc37dad6518aaee4e963849d3aa8d6a83d84b14eb74b09cd5ae4",
      "firstSeenAt": "2026-07-14T18:15:00Z",
      "publishedAt": "2026-07-14T17:36:00Z"
    },
    {
      "ref": "article-06a4b042615a6708",
      "urlHash": "06a4b042615a6708f7f93d2c667075b48a6caba551f131b1445d1847ad9feebb",
      "canonicalUrl": "https://www.wboi.org/npr-news/2026-07-13/trump-says-the-u-s-is-back-to-blockading-iran-and-will-charge-ships-a-toll-in-hormuz",
      "domain": "www.wboi.org",
      "title": "Trump says the U.S. is back to blockading Iran and will charge ships a toll in Hormuz",
      "titleInputHash": "86260853e4a003c08a74df4918ae11dfc4ff35ef8db9493a94abd5d187fbc732",
      "firstSeenAt": "2026-07-13T19:30:00Z"
    },
    {
      "ref": "article-089644fd54e86365",
      "urlHash": "089644fd54e863653849525cde1325dcaaae00801a4b88fc0d3be1b141b6987a",
      "canonicalUrl": "https://www.newsandstar.co.uk/news/national/26275278.murder-ann-widdecombe-investigated-potential-act-terrorism",
      "domain": "www.newsandstar.co.uk",
      "title": "Murder of Ann Widdecombe being investigated as potential act of terrorism",
      "titleInputHash": "395cce1a2e2c80c73f4a9c87ef21aae6932117d92cef2e0507538012e4ab203d",
      "firstSeenAt": "2026-07-13T18:30:00Z",
      "publishedAt": "2026-07-13T17:28:00Z"
    },
    {
      "ref": "article-097e20c871b136f7",
      "urlHash": "097e20c871b136f769a78deee83f1d7cb1c04f45ac595c205bc3ee0fd50e343e",
      "canonicalUrl": "https://www.barryanddistrictnews.co.uk/news/national/26273528.twenty-seven-people-killed-fire-bangkok-pub-say-officials",
      "domain": "www.barryanddistrictnews.co.uk",
      "title": "Twenty-seven people killed in fire at Bangkok pub, say officials",
      "titleInputHash": "70400b670153bba076bb42f71e259fe1eeb82ce406bca4ea6dbdcadac7b9d9eb",
      "firstSeenAt": "2026-07-12T21:30:00Z",
      "publishedAt": "2026-07-12T20:56:00Z"
    },
    {
      "ref": "article-0ad1ae8f4dcb7bc0",
      "urlHash": "0ad1ae8f4dcb7bc009aa12ba6465a439adf8a5c85eb9f4be707c4c9247f23f11",
      "canonicalUrl": "https://www.kbia.org/2026-07-13/trump-says-the-u-s-is-back-to-blockading-iran-and-will-charge-ships-a-toll-in-hormuz",
      "domain": "www.kbia.org",
      "title": "Trump says the U.S. is back to blockading Iran and will charge ships a toll in Hormuz",
      "titleInputHash": "86260853e4a003c08a74df4918ae11dfc4ff35ef8db9493a94abd5d187fbc732",
      "firstSeenAt": "2026-07-13T19:45:00Z",
      "publishedAt": "2026-07-13T12:53:00Z"
    },
    {
      "ref": "article-0f63b69d79003e84",
      "urlHash": "0f63b69d79003e84d95bcef354178260a20289ca5ff2bd939456209f797d9dfe",
      "canonicalUrl": "https://www.yoursourceone.com/columbia_basin/sen-lindsey-graham-a-close-trump-ally-and-foreign-policy-hawk-dies-after-a-brief/article_e6ed7979-fb08-4eda-9c9d-ff683917aaef.html",
      "domain": "www.yoursourceone.com",
      "title": "Sen. Lindsey Graham, a close Trump ally and foreign policy hawk, dies after a brief illness",
      "titleInputHash": "56f59a561b6228d53f5168b531de6797c9427e1392942cd8b4c335f19c388a37",
      "firstSeenAt": "2026-07-12T21:15:00Z",
      "publishedAt": "2026-07-12T17:23:00Z"
    },
    {
      "ref": "article-0fddfc262b2a7bb4",
      "urlHash": "0fddfc262b2a7bb47971c14d98ab0ebccf1bbb1c07282dcbc2e493e9fbbf684d",